Adventure Path Name,Adventure Path Link,Adventure,Adventure Name,Adventure Description
Kingmaker ,https://pathfinderwiki.com/wiki/Kingmaker_(adventure_path),Sound of a Thousand Screams,https://pathfinderwiki.com/wiki/Sound_of_a_Thousand_Screams,"With the dangers of the Stolen Lands brought to heel, the PCs rule as lords of that realm. But from an unassuming corner of their kingdom, a centuries-old plot takes shape, turning the land itself into a deadly enemy that threatens to bring their entire nation to ruin. As the boundary between the Stolen Lands and an insane other world begins to break down, it?s up to the PCs to save their people from nature gone mad and the emissaries of a reality beyond imagining. But can they retain their kingdom?and their sanity?against the fury of the First World?"
Serpent's Skull ,https://pathfinderwiki.com/wiki/Serpent%27s_Skull_(adventure_path),Souls for Smuggler's Shiv,https://pathfinderwiki.com/wiki/Souls_for_Smuggler%27s_Shiv,"A deadly storm shipwrecks the passengers and crew of the Jenivere upon infamous Smuggler's Shiv, an island off the coast of the jungle realm of Sargava. If they?re to have any hope of escaping the notorious pirates? graveyard, the survivors will need to band together to outwit the isle?s strange beasts and legendary menaces. But can the PCs unite the swift-to-squabble castaways, especially when several seem to have mysterious goals of their own? And does Smuggler's Shiv hide secrets even deadlier than its desperate denizens?"
Serpent's Skull ,https://pathfinderwiki.com/wiki/Serpent%27s_Skull_(adventure_path),Racing to Ruin,https://pathfinderwiki.com/wiki/Racing_to_Ruin,"The heroes venture to the desperate capital of the failing jungle colony Sargava to supply for an overland journey to Saventh-Yhi, the lost Azlanti City of Seven Spears. There they become embroiled in intrigue with the Pathfinder Society, the Aspis Consortium merchant league, the Pirate Lords of the Shackle Isles, and the deadly Red Mantis assassins, rivals who also seek to plunder the lost city for their own purposes. Each group uses its unique tactics to pressure the heroes into an alliance, with Sargava?s leaders promising a huge reward to the explorers who can successfully discover and explore the ruined city. With enemy factions hot on their heels, tons of unexpected encounters, and a waiting tribe of monkey-men, will the heroes survive the Screaming Jungle to reach the lost city of Saventh-Yhi before it?s too late?"
Serpent's Skull ,https://pathfinderwiki.com/wiki/Serpent%27s_Skull_(adventure_path),City of Seven Spears,https://pathfinderwiki.com/wiki/City_of_Seven_Spears,"The heroes at last emerge from the trackless jungles of the Mwangi Expanse to discover the vine-choked lost city of Saventh-Yhi, ruined outpost of the ancient kingdom of Azlant. With seven spear-like monolith towers peaking above the verdant canopy and crumbling causeways echoing with the savage cries of unknown predators, the city promises untold wealth to those brave enough to claim it. But the heroes are not alone, for their allies and enemies among Sargava?s colonist government, the Pathfinder Society, the Aspis Consortium merchant league, the Pirate Lords of the Shackle Isles, and the mysterious assassins of the Red Mantis also have designs upon the treasures of the City of Seven Spears, and the race is on to plunder the riches of the city?s many adventure sites."
Serpent's Skull ,https://pathfinderwiki.com/wiki/Serpent%27s_Skull_(adventure_path),Vaults of Madness,https://pathfinderwiki.com/wiki/Vaults_of_Madness,"A strange swashbuckler rescued in the City of Seven Spears reveals the secret beneath Saventh-Yhi ? a forgotten serpentfolk city called Ilmurea, inspiration for the superstitious native fears of a terrible evil lurking just underfoot. The heroes must accompany their new ally to rescue her captured companions in the city below, braving the trap-laden, monster-infested Vaults of Madness that stand between Saventh-Yhi and Ilmurea. But just as they venture forth, a new inhabitant takes up residence in the City of Seven Spears ? the legendary Gorilla King himself!"
Serpent's Skull ,https://pathfinderwiki.com/wiki/Serpent%27s_Skull_(adventure_path),The Thousand Fangs Below,https://pathfinderwiki.com/wiki/The_Thousand_Fangs_Below,"The heroes explore the lost underground serpentfolk city of Ilmurea only to discover that it is not nearly as abandoned as they had thought. Feral descendants of the original Azlanti inhabitants of the surface City of Seven Spears have degenerated into subterranean morlocks, devolving into madness and evil over thousands of years. Malign creatures from throughout the Darklands flock to Ilmurea to prey upon these dwellers, and serpentfolk from around the world flock to Ilmurea, beckoned by the severed head of their slain ophidian god, Ydersius. A grim ritual, already in progress, will use the power of the Serpent's Skull to restore the serpentfolk of Golarion to their true, terrible potential, instantly creating a new menace below all the nations of the world. A lost Pathfinder holds the key to disrupting the ritual, but before his plan can be executed he must first be rescued from his underground prison."
Serpent's Skull ,https://pathfinderwiki.com/wiki/Serpent%27s_Skull_(adventure_path),Sanctum of the Serpent God,https://pathfinderwiki.com/wiki/Sanctum_of_the_Serpent_God,"Returning from battles against serpentfolk in the underworld, the heroes must raise an army among the war-torn jungle ruins of Saventh-Yhi to annihilate the growing evils below. Yet raising such a force tests not just their diplomatic skills, but subjects them to brutal tests of courage and strength. With a savage army united, a path to the serpentfolk stronghold beneath the city must be opened, requiring the activation of an ancient device that drops seven of the city's massive towers to impale the accursed ruins below. As the warriors of the jungles do battle with legions of snakemen, the heroes make their way to the temple of the snake god Ydersius to face the serpentfolk's mad high priest and disrupt a ritual threatening to return the ancient evil god to terrible life."
Carrion Crown,https://pathfinderwiki.com/wiki/Carrion_Crown,The Haunting of Harrowstone,https://pathfinderwiki.com/wiki/The_Haunting_of_Harrowstone,"The prison of Harrowstone has long been an empty ruin, haunted by more than the mysteries and memories of a tragic past. When invaded by the death-crazed servants of the Whispering Way, a cult dedicated to the service of the infamous lichTar-Baphon, Harrowstone?s long-quiet population of ghostly inmates rises in an undead revolt. Brought together by the death of an ally, the heroes unite to save the residents of a tormented town and lay the spirits of Harrowstone to rest. Yet doing so brings new life to a long-forgotten mystery, where avenging an innocent?s murder means putting an end to some of Ustalav?s most infamous criminals for a second time."
Carrion Crown,https://pathfinderwiki.com/wiki/Carrion_Crown,Trial of the Beast,https://pathfinderwiki.com/wiki/Trial_of_the_Beast,"The Beast of Lepidstadt, a savagely cunning flesh golem, has long terrorized the simple folk of the land, murdering, robbing, and sowing carnage none can withstand. The mad golem?s reign of terror comes to an end, though, when captured mid-rampage. Yet, rather than destroy the monster, the enlightened council of the city of Lepidstadt insists the obviously thinking creature face a lawful trial. While on the trail of the Whispering Way, the heroes find their fates intertwined with that of the Beast, enlisted to guard it against infuriated townsfolk, scholars of the macabre, and the slaves of its mad creator. When a violent attack releases the berserker, its trail leads to the laboratory lair of a mad scientist and his blasphemous creations, crazed conspirators in the maniacal plot of the Whispering Way."
Carrion Crown,https://pathfinderwiki.com/wiki/Carrion_Crown,Broken Moon,https://pathfinderwiki.com/wiki/Broken_Moon,"When the savage lord of Ustalav?s werewolves is mysteriously murdered, the nation?s forests run with lycanthropic blood. War in the wilds soon spills onto the streets, as the people of the land, seeing the strife among their long-time foes, begin a hunt to scour the nation of the deadly shape-shifters. Entreated by a lord of the werewolves to help unite his savage people, the heroes must risk becoming tainted by the curse of lycanthropy as they race across the heart of the nation to find an outcast heir. But can they do so before bestial assassins and the agents of the Whispering Way find him, or the heroes, first?"
Carrion Crown,https://pathfinderwiki.com/wiki/Carrion_Crown,Wake of the Watcher,https://pathfinderwiki.com/wiki/Wake_of_the_Watcher,"No one goes to Illmarsh, a decrepit village haunted by tales of ghastly midnight rites and sacrifices to shadows from the sea. When the heroes learn of an unholy bargain between the cultists of the Whispering Way and the drowned gods of this wretched town, they must journey through a wilderness gone wrong to prevent it. But an eerie evil has also set its eye on Illmarsh, and the community?s deep lords are the first to fall. Can the heroes discover what foulness festers in the mind of Illmarsh? And will they be able to withstand the whispers of an insanity from beyond the stars?"
Carrion Crown,https://pathfinderwiki.com/wiki/Carrion_Crown,Ashes at Dawn,https://pathfinderwiki.com/wiki/Ashes_at_Dawn,"A killer stalks the streets of Caliphas, a murderer whose victims are already dead. Something is preying upon the ancient vampire clans of Ustalav's capital, a mysterious foe who threatens the centuries-old truce tenuously held by generations of both the living and the undead. Into this madness enter the heroes, closing in on the death cultists of the Whispering Way. What role do the deadly necromancers have in the undead murders plaguing Caliphas? What secret grudge exists between the cult and the rulers of the night? And will the heroes be able to save the capital without sacrificing their very souls?"
Carrion Crown,https://pathfinderwiki.com/wiki/Carrion_Crown,Shadows of Gallowspire,https://pathfinderwiki.com/wiki/Shadows_of_Gallowspire,"The plot of an undead-obsessed cult, the Whispering Way, comes to its terrifying climax! With relics gathered from across the land, the death worshipers travel to the most feared location in the Pathfinder campaign setting, the tower of Gallowspire, wherein lurk the deathless remains of the immortal evil wizard known as the Whispering Tyrant. There the cultists plot to conduct a ritual to resurrect the notorious villain, using their collected relics to transform an innocent into a new undead body for the imprisoned archmage. Can the heroes withstand the ageless evil of Gallowspire to finally defeat the Whispering Way? Or will the Whispering Tyrant, one of the greatest fiends ever known, be unleashed upon the world once more?"
Jade Regent ,https://pathfinderwiki.com/wiki/Jade_Regent_(adventure_path),The Brinewall Legacy,https://pathfinderwiki.com/wiki/The_Brinewall_Legacy,"When the LicktoadGoblins of Brinestump Marsh get hold of a crate of fireworks, adventurers are needed to handle the explosive and annoying situation. But in vanquishing the pyromaniac goblins, the heroes uncover a secret that had been hidden in the marsh for nearly a quarter of a century?a secret that sends them north to the mysterious ruins of Brinewall Castle, where a powerful legacy waits to be rediscovered. The fate of a nation on the far side of the world falls into the heroes' hands with the recovery of this legacy?will they be equal to the task of restoring balance to an empire on the verge of collapse?"
Jade Regent ,https://pathfinderwiki.com/wiki/Jade_Regent_(adventure_path),Night of Frozen Shadows,https://pathfinderwiki.com/wiki/Night_of_Frozen_Shadows,"With the discovery that Ameiko Kaijitsu is the last in the line of a family destined to rule in the Dragon Empire of Minkai, she and her friends join with a Varisian caravan and head north to the Linnorm Kingdoms, taking their first step on the long journey to Tian Xia. Arriving in the capital city of Kalsgard in order to hire a guide for the treacherous journey over the Crown of the World, the PCs learn that Ameiko's family passed through here years ago, but left behind a powerful sword that could hold further clues to their now-shared destiny. But the sword's been stolen and their would-be guide has gone missing?and attempts to find either quickly arouse the wrath of the mysterious assassins known as the Frozen Shadows."
Jade Regent ,https://pathfinderwiki.com/wiki/Jade_Regent_(adventure_path),The Hungry Storm,https://pathfinderwiki.com/wiki/The_Hungry_Storm,"The ancient sword Suishen recovered and their guide Ulf Gormundr rescued, the time has come to take the longest portion of the journey to Minkai?a voyage across the frozen Crown of the World at Golarion's north pole. Warned that attempting this continental crossing in the off-season could be dangerous, the travelers quickly find the situation is much worse, for the legendary blizzards of the northern continent seem to have a mind of their own. Hounded every step of the way by icy threats, arctic beasts, and the beasts' mistress?a powerful and mysterious antagonist?the PCs uncover a threat that could start a new ice age if left alone. Will attempting to halt the advance of the Hungry Storm spell the PCs' doom even before they reach Minkai?"
Jade Regent ,https://pathfinderwiki.com/wiki/Jade_Regent_(adventure_path),Forest of Spirits ,https://pathfinderwiki.com/wiki/Forest_of_Spirits_(adventure),"The PCs arrive in Tian Xia only to learn what they had feared has come true: the empire of Minkai is controlled by a despotic ruler known as the Jade Regent. His agents lie in wait for the PCs and watch every road into the empire, but an unlikely friend shows the travelers a hidden route south into Minkai, revealing that the Jade Regent works for an ancient organization of evil spirits called the Five Storms. Before the PCs enter Minkai to attempt to save the empire, they must first explore the abandoned stronghold of the Five Storms deep within the mysterious Forest of Spirits. While many important secrets and useful tools to aid in the Jade Regent's defeat await discovery in this stronghold, the heroes soon learn that the place is not nearly as abandoned as they might like..."
Jade Regent ,https://pathfinderwiki.com/wiki/Jade_Regent_(adventure_path),Tide of Honor,https://pathfinderwiki.com/wiki/Tide_of_Honor,"The PCs arrive in Minkai only to discover the empire is on its knees. The Jade Regent has twisted the ruling government to cater to his despotic whims, and throughout the realm, the people suffer. Before the PCs can attempt to stand against the Jade Regent and liberate Minkai, they must first earn the trust and respect of the ancient empire's people and recruit aid from throughout the beleaguered empire?all the while dodging the oni and ninja agents controlled by the Five Storms. Liberating monasteries ruled by oni, rescuing a famous geisha from a deadly island prison, defeating armies of bandits led by monsters, and standing tall before a corrupt daimyo's army of samurai are all in a day's work for the would-be liberators of the empire."
Jade Regent ,https://pathfinderwiki.com/wiki/Jade_Regent_(adventure_path),The Empty Throne,https://pathfinderwiki.com/wiki/The_Empty_Throne,"War has come to Minkai! As the resistance rises against the Jade Regent's tyranny, the PCs must escort their friend Ameiko to one final site?the Imperial Shrine on a hidden island in the capital's harbor. Here, Ameiko and the PCs must seek the blessing of Minkai's dead emperors if they hope to have a chance to liberate the nation, but even here the Five Storms and the Jade Regent have their influence, and hungry demons and ravenous ghosts must be defeated before the ancestor spirits of the empire will give their blessings. Only then can the PCs take the battle to the Imperial Palace and confront the Jade Regent and his allies in the Five Storms."
Skull & Shackles,https://pathfinderwiki.com/wiki/Skull_%26_Shackles,The Wormwood Mutiny,https://pathfinderwiki.com/wiki/The_Wormwood_Mutiny,"Pirates take whatever they please, whether it be ships, plunder, or people! The adventurers wake to find themselves press-ganged into the crew of the pirate ship Wormwood, the vessel of the nefarious Captain Barnabus Harrigan. They?ll have to learn how to survive as pirates if they?re to have any hope of weathering rough waves, brutal crew members, enemy pirates, ravenous beasts, and worse. But when fortune turns to their favor, it?s up to the new crew to decide whether they?ll remain the pirate?s swabs or seize control and set sail for adventures all their own."
Skull & Shackles,https://pathfinderwiki.com/wiki/Skull_%26_Shackles,Raiders of the Fever Sea,https://pathfinderwiki.com/wiki/Raiders_of_the_Fever_Sea,"Bound for adventure upon the pirate vessel they?ve taken as their own, the heroes face a sea of dangers as they chart a course to become true Free Captains of the Shackles. But life as a pirate doesn?t prove any easier now that they?re in command, as deadly sea monsters, the corpses of drowned scallywags, and raiders from the deep rise to oppose them. When a most unusual map falls into the adventurers? hands, they have the chance to change their fate in a single daring raid. Is it the heroes? destiny to be the next victims of the merciless waves, or will fortune smile upon them and spur their rise as the newest and most infamous pirates of the Shackles?"
Skull & Shackles,https://pathfinderwiki.com/wiki/Skull_%26_Shackles,Tempest Rising,https://pathfinderwiki.com/wiki/Tempest_Rising,"The time has come for the heroes to take their places as true pirate lords. But doing so will require more than a ship, a scallywag crew, and a hold full of plunder?they?ll need to win the esteem of the Hurricane King himself. If they succeed, they?ll earn the right to claim even greater glory by participating in the Free Captains? Regatta, a grueling race along the fringes of the mighty hurricane called the Eye of Abendego. The winners receive a fat prize purse, their own private island, and a seat on the Pirate Council of the Shackles. Will the adventurers triumph against fierce competitors, old rivals, and the treacherous winds and currents of the Eye? Or will their ship be claimed by the storm, a doom that?s befallen so many before them?"
Skull & Shackles,https://pathfinderwiki.com/wiki/Skull_%26_Shackles,Island of Empty Eyes ,https://pathfinderwiki.com/wiki/Island_of_Empty_Eyes_(adventure),"Having won the Free Captains' Regatta, the adventurers must now claim their prize?the uninhabited Island of Empty Eyes. Yet exploring strange ruins and fighting the isle?s monstrous denizens won?t be enough. Once they?ve got things well in hand, the adventurers must host a feast for the Shackles' infamous Pirate Council, only to have a dangerous situation turn even worse when a mysterious saboteur threatens to disrupt the party. Can the adventurers tame their island and protect their influential guests? Or will they lose the respect of the pirate lords and fade into obscurity?"
Skull & Shackles,https://pathfinderwiki.com/wiki/Skull_%26_Shackles,The Price of Infamy,https://pathfinderwiki.com/wiki/The_Price_of_Infamy,"The adventurers now have their own island and port, but they?ll need more than one ship to defend it. When a past rival sends a fleet to attack them, they?re forced to pull out all the stops to defend their island home, scouring the harbors and docks of the Shackles in order to recruit more ships and crews to their flag. Yet when they sail to the attacker?s own island to get their revenge, the adventurers discover a traitor?one whose betrayal threatens not only their own fleet, but the very islands of the Shackles themselves."
Skull & Shackles,https://pathfinderwiki.com/wiki/Skull_%26_Shackles,From Hell's Heart,https://pathfinderwiki.com/wiki/From_Hell%27s_Heart,"With an enemy fleet intent on conquering the Shackles looming on the horizon, the adventurers must launch their own fleet of pirates and buccaneers to defend against the invaders, culminating in an epic naval battle at the edge of the Eye of Abendego. Will the adventurers defeat the invading navy and save the Shackles? Or will the independence of the Free Captains be eradicated forever?"
Shattered Star ,https://pathfinderwiki.com/wiki/Shattered_Star_(adventure_path),Shards of Sin,https://pathfinderwiki.com/wiki/Shards_of_Sin,"In Varisia's bustling frontier town of Magnimar, the Pathfinder Society's newest lodge recruits a team of rookie Pathfinder agents to track down rogue agent Natalya Vancaskerkin?who also happens to be a member of the Varisian criminals known as the Sczarni. Yet when Magnimar's newest heroes track down the missing woman, they find far more than a Pathfinder on the run, becoming embroiled in a quickly expanding hunt for a fragmented artifact from the height of the ancient empire of Thassilon that will take them to some of the most dangerous corners of Varisia!"
Shattered Star ,https://pathfinderwiki.com/wiki/Shattered_Star_(adventure_path),Curse of the Lady's Light,https://pathfinderwiki.com/wiki/Curse_of_the_Lady%27s_Light,"Varisia's newest heroes have stumbled across a powerful relic from the ancient empire of Thassilon?yet the artifact has been sundered into seven fragments. The third of these fragments lies in the swampy Mushfens south of the city of Magnimar, hidden within an ancient, towering lighthouse known as the Lady's Light. With squabbling boggards, troglodytes, and other swamp monsters dwelling in the region around the Light, approaching the ruins will require either stealth or bravado. But the threats posed by slimy and scaly humanoids pales in comparison to the exiled Gray Maidens who have claimed the interior of the Light as their new headquarters?or to the sinister curse that afflicts the powerful, ancient caretaker of the ruin."
Shattered Star ,https://pathfinderwiki.com/wiki/Shattered_Star_(adventure_path),The Asylum Stone,https://pathfinderwiki.com/wiki/The_Asylum_Stone,"The hunt for the seven shards of the Shattered Star continues, with the heroes following the trail across the face of Varisia and into the notorious City of Strangers?Kaer Maga! There, the heroes encounter strange enemies and stranger allies as their quest for the ancient Thassilonian artifact embroils them in the politics of Varisia's most exotic city. What secrets lie hidden in the dark and deadly realms deep under Kaer Maga, where things best shunned from day's light and sane minds lie in wait? Will the heroes survive their descent below, or will the Dark Rider claim their heads for his ever-growing collection?"
Shattered Star ,https://pathfinderwiki.com/wiki/Shattered_Star_(adventure_path),Beyond the Doomsday Door,https://pathfinderwiki.com/wiki/Beyond_the_Doomsday_Door,"The hunt for the seven shards of the Shattered Star leads the heroes back to the western coast of Varisia, to the multifaith monastery known as Windsong Abbey. The next shard of the Shattered Star appears to be hidden somewhere within the dungeons below the abbey. But when the PCs arrive, they find the monastery in ruins and held by savage giants and twisted fey! An ancient terror has returned home, and now dwells within the deep dungeons below?a terror who hopes to open the dread Doomsday Door deep within!"
Shattered Star ,https://pathfinderwiki.com/wiki/Shattered_Star_(adventure_path),Into the Nightmare Rift,https://pathfinderwiki.com/wiki/Into_the_Nightmare_Rift,"With five shards of the Shattered Star secure, visions point toward one of Varisia's most remote corners as the site protecting the sixth fragment of the powerful artifact. Yet the heroes are not the first to search for this shard?upon arriving at the ancient ruin known as Guiltspur, they find a small army of giants said to be ruled by a blue dragon already excavating the site. And as the heroes soon learn, there are other forces searching for the final shards from the Darklands below, and even from beyond reality itself, for Guiltspur lies dangerously close to the nightmare realm of Leng!"
Shattered Star ,https://pathfinderwiki.com/wiki/Shattered_Star_(adventure_path),The Dead Heart of Xin,https://pathfinderwiki.com/wiki/The_Dead_Heart_of_Xin,"The seven shards of the Shattered Star have been recovered, and the Pathfinders prepare a grand festival on Magnimar's Irespan to celebrate this incredible achievement. The culmination of this celebration is to be the reassembly of the seven shards into the legendary Sihedron itself, rebuilt for the first time in over ten thousand years. But a lot can change in that amount of time, and as the ritual to reforge the artifact finishes, ancient contingencies rumble to life, and as the dead heart of Thassilon begins to beat again, all of Magnimar is put in terrible danger. With the power of the Sihedron on their side, the heroes take a stance against this risen evil?but will the aid of an ancient artifact be enough to save them all?"
Reign of Winter,https://pathfinderwiki.com/wiki/Reign_of_Winter,The Snows of Summer,https://pathfinderwiki.com/wiki/The_Snows_of_Summer,"Every 100 years, the Witch Queen Baba Yaga returns to the nation of Irrisen to place a new daughter on the throne, but this time, something has gone wrong. Far to the south, an unseasonable winter cloaks the forest near the village of Heldren with summer snows. When the heroes venture into the wood in search of a missing noblewoman, they discover a magical portal to the frozen land of Irrisen, whose magical winter will soon engulf all of Golarion unless they can discover the fate of the otherworldly witch Baba Yaga, a quest that will take them through snowbound Irrisen to even stranger lands beyond."
