Adventure Path Name,Adventure Path Link,Adventure,Adventure Name,Adventure Description
Reign of Winter,https://pathfinderwiki.com/wiki/Reign_of_Winter,The Shackled Hut,https://pathfinderwiki.com/wiki/The_Shackled_Hut,"The winter portal has closed, but the heroes now find themselves trapped in the frozen land of Irrisen with an urgent quest?to find Baba Yaga! In order to track down the missing Queen of Witches, the heroes must brave the monster-infested capital city of Whitethrone, where Baba Yaga's Dancing Hut has been captured and put on display. Will possession of the miraculous artifact lead them to the Witch Queen, or will they die a cold death at the hands of Irrisen's White Witches?"
Reign of Winter,https://pathfinderwiki.com/wiki/Reign_of_Winter,"Maiden, Mother, Crone","https://pathfinderwiki.com/wiki/Maiden,_Mother,_Crone","On the trail of Baba Yaga, the heroes find themselves on a new continent, in the barbaric land of Iobaria in far-off Casmaron. The heroes must explore three ancient, mystically linked dungeons in search of more clues to the fate of the Queen of Witches, but they must also contend with savage centaurs and demon-worshiping frost giants who seek to claim Baba Yaga's secrets for themselves."
Reign of Winter,https://pathfinderwiki.com/wiki/Reign_of_Winter,The Frozen Stars,https://pathfinderwiki.com/wiki/The_Frozen_Stars,"Continuing their search for Baba Yaga, the heroes take the Dancing Hut to the planet of Triaxus, seventh world in Golarion's solar system, now in the middle of its decades-long winter. The heroes soon find themselves embroiled in a conflict between the dragonriders of the Skyfire Mandate and the barbarian armies of a white dragon warlord in their hunt for more clues to the whereabouts of Baba Yaga. Will the PCs ally with one of the warring factions to get the information they need, or will their quest come to an end on a distant, alien world?"
Reign of Winter,https://pathfinderwiki.com/wiki/Reign_of_Winter,Rasputin Must Die!,https://pathfinderwiki.com/wiki/Rasputin_Must_Die!,"The search for the Queen of Witches finally ends when the Dancing Hut travels to Baba Yaga's homeland of Russia on the planet Earth. The year is 1918, and the First World War rages throughout Europe. The heroes find themselves in the wilds of Siberia, where they must face Russian soldiers armed with 20th-century technology to infiltrate an ancient monastery and rescue Baba Yaga from her estranged son, Grigori Rasputin. Can the heroes kill the ""Mad Monk,"" who has already cheated death once before, and free Baba Yaga, or will they too fall before the horrors of modern war?"
Reign of Winter,https://pathfinderwiki.com/wiki/Reign_of_Winter,The Witch Queen's Revenge,https://pathfinderwiki.com/wiki/The_Witch_Queen%27s_Revenge,"Baba Yaga has been rescued from the clutches of her son Rasputin, but the Queen of Witches remains trapped inside a magical matryoshka doll. Delving into hidden chambers deep within the Dancing Hut, the heroes must open the nesting dolls imprisoning Baba Yaga, but they also must contend with the hut's most dedicated guardians, including the former queens of Irrisen. The campaign reaches its climax when the heroes finally face Queen Elvanna, fourteenth daughter of Baba Yaga, inside the Dancing Hut's innermost sanctum. Will the heroes defeat Elvanna and finally free Baba Yaga, or will their failure plunge Golarion into a new ice age ruled by the Witch Queen of Irrisen?"
Wrath of the Righteous,https://pathfinderwiki.com/wiki/Wrath_of_the_Righteous,The Worldwound Incursion,https://pathfinderwiki.com/wiki/The_Worldwound_Incursion,"When a wardstone falls, the city of Kenabres is assaulted by a demon host. Massive demons smash paths of ruin through the city, while droves of the worst the Worldwound has to offer spread through the streets, offering death, dismemberment, and horror to all they find. The collapse of one of Kenabres's greatest landmarks, the Cathedral of Saint Clydwell, sends the heroes tumbling into forgotten catacombs deep below the city, from which they must find their way out or perish alone in the dark. But when they finally emerge, they find Kenabres transformed into a post-apocalyptic devastation. Can the heroes navigate the dying city and make contact with the ragged remnants of the Silver Crusade in time to aid them in defending the city's refugees until the cavalry arrives? And what of the damaged wardstone that flashes and thunders across the ruined cityscape?has the city's one-time defense become a ticking time bomb poised to deliver a death blow to them all?"
Wrath of the Righteous,https://pathfinderwiki.com/wiki/Wrath_of_the_Righteous,Sword of Valor ,https://pathfinderwiki.com/wiki/Sword_of_Valor_(adventure),"The PCs, now Mythic heroes invested with righteous power, are poised to become the greatest heroes of the war effort against the demons, provided they can survive and succeed at their first mission. The citadel and city of Drezen was once the pride and joy of the crusaders, a symbol of their triumph in the First Crusade against the Worldwound. Yet this triumph was short-lived, for when a larger horde of demons attacked, they shattered Drezen's defenses and captured the citadel and the Crusaders' symbol of power?the Sword of Valor. Can the PCs and an allied team of specialists lead an army north to reclaim Drezen and recover the Sword of Valor, or are they marching their friends and followers into certain death?"
Wrath of the Righteous,https://pathfinderwiki.com/wiki/Wrath_of_the_Righteous,Demon's Heresy,https://pathfinderwiki.com/wiki/Demon%27s_Heresy,"The heroes have reclaimed the city of Drezen and the lost sacred banner known as the Sword of Valor, and in doing so have established a significant foothold behind enemy lines. With the demon armies still concentrating their attacks to the south, the heroes must now set off into the heart of the Worldwound to seek out powerful new allies (including a succubus who may have been redeemed by Desna, the goddess of dreams) and strike a mortal blow against the Templars of the Ivory Labyrinth?but in doing so, they discover a disturbing truth about the crystalline sources of mythic power the demons have been using against the crusaders."
Wrath of the Righteous,https://pathfinderwiki.com/wiki/Wrath_of_the_Righteous,The Midnight Isles,https://pathfinderwiki.com/wiki/The_Midnight_Isles,"An audience with the Crusader Queen leads the heroes through a mysterious portal to an otherworldly fortress that lies betwixt Golarion and the demonic Abyss. Bringing the fight for the Worldwound to its demonic source means dealing with the cultists of Deskari, demon prince of locusts, who infest the castle like a swarm of insects. Beyond the fortress lies the Abyssal realm of the Midnight Isles, lair of the succubus queen Nocticula, wherein lies the final secret of the powerful crystals empowering the Worldwound?s demonic armies with mythic power. Can the heroes navigate the intrigues of three demon lords to strike a critical blow for the forces of good without losing their souls to darkness?"
Wrath of the Righteous,https://pathfinderwiki.com/wiki/Wrath_of_the_Righteous,Herald of the Ivory Labyrinth,https://pathfinderwiki.com/wiki/Herald_of_the_Ivory_Labyrinth,"The cult of Baphomet has been delivered a critical blow, yet the Horned Lord remains, and now he's taken hostage the herald of Iomedae, goddess of justice and valor. The heroes of the Fifth Crusade must attempt their most dangerous and audacious mission yet?they must travel to Baphomet?s Abyssal Realm, the Ivory Labyrinth, and navigate its trackless mazes in order to discover the ancient prison in which he?s keeping the abducted herald. Can the heroes rescue the goddess?s messenger, or are they already too late? And was the abduction merely a lure by the demon lord Baphomet to get the heroes to fall into his clutches?"
Wrath of the Righteous,https://pathfinderwiki.com/wiki/Wrath_of_the_Righteous,City of Locusts,https://pathfinderwiki.com/wiki/City_of_Locusts,"The heroes of the Fifth Crusade have risen to heights of power undreamed of and have dealt blow after blow to the demonic armies of the Worldwound. As they return to Golarion from the Abyss, though, they find that their enemies are no longer sending minions after them?they've drawn the attention of not only the leaders of the Worldwound, but that of their demonic patron, Deskari, Lord of the Locust Host. The method for closing the Worldwound permanently lies within the heroes? grasp, but in order to do so they must venture where no crusader has ever returned from intact. They must enter the crumbling City of Locusts to defeat its demonic ruler, but even this is but a stepping stone to the final battle against Deskari himself!"
Mummy's Mask,https://pathfinderwiki.com/wiki/Mummy%27s_Mask,The Half-Dead City,https://pathfinderwiki.com/wiki/The_Half-Dead_City,"In Wati, the half city, the church of Pharasma holds a lottery allowing explorers to delve the tombs of the city?s vast necropolis in search of the nation?s lost glories. In the course of investigating dusty tombs and fighting their ancient guardians and devious traps, the heroes encounter a rival adventuring group intent on keeping one tomb?s treasures for themselves. At the same time, the heroes learn that a potent artifact, potentially capable of animating the dead, has been stolen from the tomb. Can the adventurers defeat their rivals, or will they join the undead defenders of the city?s necropolis?"
Mummy's Mask,https://pathfinderwiki.com/wiki/Mummy%27s_Mask,Empty Graves,https://pathfinderwiki.com/wiki/Empty_Graves,"Following the opening of its necropolis, the city of Wati is overrun by hordes of the unquiet dead. The heroes must once more brave the abandoned streets and dusty tombs of Wati?s necropolis in search of the powerful artifact called the Mask of the Forgotten Pharaoh and the necromancer who is using it to create the undead uprising. But a group of mysterious masked cultists also seeks the artifact to bring a pharaoh from the ancient past back to life. Can the heroes defeat the evil necromancer and return the dead to their graves, or will the half-city of Wati truly become a city of the dead?"
Mummy's Mask,https://pathfinderwiki.com/wiki/Mummy%27s_Mask,Shifting Sands,https://pathfinderwiki.com/wiki/Shifting_Sands,"To learn more about the ancient Pharaoh Hakotep I and the secretive cult that wants to revive him, the heroes travel to the city of Tephu to explore its vast archives, but they must first contend with those who want such knowledge to remain forgotten. With the clues they gain there, the heroes venture deep into Osirion?s uncharted deserts in search of the tomb of the architect who built Hakotep?s pyramid, facing dangerous denizens of the desert as well as the cult of the Forgotten Pharaoh, who will stop at nothing to ensure their god-king remains undisturbed."
Mummy's Mask,https://pathfinderwiki.com/wiki/Mummy%27s_Mask,Secrets of the Sphinx,https://pathfinderwiki.com/wiki/Secrets_of_the_Sphinx,"The heroes track down the cult of the Forgotten Pharaoh to its secret headquarters inside a giant sphinx statue in the Osirian desert, facing scorpion-men mercenaries and Areshkagal-worshiping maftets before a final confrontation with masked cultists and their leader, the Forgotten Pharaoh, who has been possessed by a fragment of Hakotep I?s soul. The heroes defeat the cult, only to learn that Hakotep?s soul has returned to his tomb, and the ancient pharaoh has risen as a powerful mummy lord intent on reclaiming his lost kingdom!"
Mummy's Mask,https://pathfinderwiki.com/wiki/Mummy%27s_Mask,The Slave Trenches of Hakotep,https://pathfinderwiki.com/wiki/The_Slave_Trenches_of_Hakotep,"The Sky Pharaoh Hakotep I has risen and launched an attack against the city of Wati with his infamous flying pyramid. The heroes return to Wati to defend the city against this menace, only to discover that the attack is just the preface to a larger invasion of Osirion, controlled from Hakotep?s own flying tomb. Will the heroes call down the flying pyramid of the Sky Pharaoh from the sky, or will their bones join the thousands of skeletons that lie within the Slave Trenches of Hakotep?"
Mummy's Mask,https://pathfinderwiki.com/wiki/Mummy%27s_Mask,Pyramid of the Sky Pharaoh,https://pathfinderwiki.com/wiki/Pyramid_of_the_Sky_Pharaoh,"Hakotep?s flying pyramid has been grounded, but the heroes must enter the ancient tomb to deactivate the fleet of smaller flying pyramids poised to attack Osirion. Deep inside the Pyramid of the Sky Pharaoh, an untouched tomb from the heights of Ancient Osirion, the heroes face undying guardians woken from ageless sleep, climaxing in a final battle with the reborn Sky Pharaoh Hakotep himself. Will the heroes defeat Hakotep and reunite the pieces of his sundered soul to send it into the Great Beyond, or will Osirion enter a new age under the rule of an undead mummy from the distant past?"
Iron Gods ,https://pathfinderwiki.com/wiki/Iron_Gods_(adventure_path),Fires of Creation,https://pathfinderwiki.com/wiki/Fires_of_Creation,"A strange violet bonfire burns atop the town of Torch?s central hill, its flames hot enough to allow smiths to work with the hardest of exotic metals harvested from the enormous crashed starship at Numeria?s heart. When the fire is suddenly extinguished, the heroes must delve a previously unknown set of caves below the town that lead to a strange buried metallic ruin. Will the heroes survive the technological dungeon, or will they fall in a hail of robotic foes and laser fire?"
Iron Gods ,https://pathfinderwiki.com/wiki/Iron_Gods_(adventure_path),Lords of Rust ,https://pathfinderwiki.com/wiki/Lords_of_Rust_(adventure),"The heroes of the town of Torch follow a trail of clues to the sprawling junkyard known as Scrapwall, where bands of desperate and violent bandits vie for control over the technological leavings and ruins found within. The Lords of Rust dominate Scrapwall, and their swiftly rising power threatens more than the town of Torch. For they have the support of one of the Iron Gods of Numeria, and what slumbers fitfully beneath the wreckage of Scrapwall could catapult the Lords of Rust into a new level of power if they?re not stopped!"
Iron Gods ,https://pathfinderwiki.com/wiki/Iron_Gods_(adventure_path),The Choking Tower,https://pathfinderwiki.com/wiki/The_Choking_Tower,"The Lords of Rust and their strange Iron God have been defeated, but in doing so, Numeria?s newest heroes uncovered a greater threat to the land than that posed by a gang of bandits. Another, more powerful Iron God is rising in power in the enigmatic Silver Mount, but before it can be confronted, the legacy of this strange deity?s first worshiper must be recovered. Clues lead to the technophobic town of Iadenveigh, a farming community with its own need for heroes. What role could the mysterious Smoke Wizard of the Choking Tower play in this unfolding threat? Can the heroes prepare for their inevitable confrontation with Numeria?s Iron God in time?"
Iron Gods ,https://pathfinderwiki.com/wiki/Iron_Gods_(adventure_path),Valley of the Brain Collectors,https://pathfinderwiki.com/wiki/Valley_of_the_Brain_Collectors,"The heroes of Numeria must brave a remote canyonland known as the Scar of the Spider. Clues found in the Choking Tower revealed that a mysterious prophet left her legacy behind in this valley long ago? a legacy that could reveal methods to defeat the Iron God of the Silver Mount. But the heroes are neither the only nor the first visitors to the Scar of the Spider, and as they explore, they realize that alien monstrosities have colonized the canyon and have horrific agendas of their own. Can the heroes escape with their brains intact, or will they become merely the latest addition to an otherworldly collection?"
Iron Gods ,https://pathfinderwiki.com/wiki/Iron_Gods_(adventure_path),Palace of Fallen Stars ,https://pathfinderwiki.com/wiki/Palace_of_Fallen_Stars_(adventure),"Numeria?s capital city of Starfall sprawls in the shadow of the region?s most infamous ruin, Silver Mount. Here, the nation?s sadistic Technic League and the Black Sovereign rule the land and control access to incredible and dangerous technological wonders, including the mysterious Silver Mount itself. Yet, before the heroes of Numeria can oppose it, they must first defeat the Technic League and the Black Sovereign in turn, for they control access to the legendary site. Will the clues harvested from an ancient android oracle and the technological wonders gathered from strange ruins across Numeria be enough for the heroes to prevail? Or will they simply become the latest upstarts to be crushed under the Technic League?s metal boot?"
Iron Gods ,https://pathfinderwiki.com/wiki/Iron_Gods_(adventure_path),The Divinity Drive,https://pathfinderwiki.com/wiki/The_Divinity_Drive,"Silver Mount has long beckoned explorers and adventurers from across the Inner Sea with its promises of exotic, otherworldly treasures. Yet more than treasure waits within the alien chambers within this towering ruin?here, the greatest of the Iron Gods dwells, inexorably drawing its plans against the world of flesh and preparing for its final triumphant emergence from the eons of time. With allies recruited from across the land of Numeria and the brutish rulership of its capital city (for the time being) cowed, the time is right for the most extensive expedition into Silver Mount?s mysterious interior. What strange perils from beyond the stars await the heroes within the metal walls of one of Golarion?s most legendary dungeons, and could they just be walking into an Iron God?s trap?"
Giantslayer,https://pathfinderwiki.com/wiki/Giantslayer,Battle of Bloodmarch Hill,https://pathfinderwiki.com/wiki/Battle_of_Bloodmarch_Hill,"In the human town of Trunau, a beleaguered settlement surrounded by the brutal orcs of the Hold of Belkzen, the heroes must investigate a mysterious death. Before they uncover the truth, however, Trunau comes under attack by an orc army, and the heroes must help defend it, only to discover the real reasons behind both the murder and the orc raid?both were just distractions from a wider conspiracy involving a giant chieftain, who seeks the treasures of the forgotten tomb of an ancient giant hero beneath the town."
Giantslayer,https://pathfinderwiki.com/wiki/Giantslayer,The Hill Giant's Pledge,https://pathfinderwiki.com/wiki/The_Hill_Giant%27s_Pledge,"The marauding orcs have been defeated, but great danger remains?the hill giant chieftain Grenseldek did not recover the treasures of the tomb beneath the besieged town of Trunau, and she will never rest until she has made them her own. The heroes must travel by riverboat through the orc-hold of Belkzen to the abandoned border fort that the giant has claimed as her lair and put a stop to the threat at its source!"
Giantslayer,https://pathfinderwiki.com/wiki/Giantslayer,Forge of the Giant God,https://pathfinderwiki.com/wiki/Forge_of_the_Giant_God,"The heroes explore the tomb of a legendary giantslayer before venturing into the Mindspin Mountains in search of the valley where the Storm Tyrant is recruiting giants for his army. The adventurers must confront the numerous giants inhabiting the winding valley before making their way to the giant headquarters, an ancient temple to the giant god Minderhal, which contains a powerful artifact. But the valley of the giants is just a recruiting station, and the Storm Tyrant?s stone giant representative has been sending the most promising recruits to a training camp deeper in the mountains."
Giantslayer,https://pathfinderwiki.com/wiki/Giantslayer,Ice Tomb of the Giant Queen,https://pathfinderwiki.com/wiki/Ice_Tomb_of_the_Giant_Queen,"Following the trail of the Storm Tyrant's armies, the heroes come to a frost giant village that serves as a training camp, led by a frost giant graveknight who issues orders from within an icy crypt. As the heroes engage in guerrilla tactics to weaken the army of giants and disband the camp, they can ally with a red dragon who seeks to infiltrate the village for her own purposes. Once they've broken the ranks of the giants, the heroes venture into a frozen tomb where they must defeat cultists of the Pallid Princess, morbid tomb giants, and undead war machines before engaging in a climactic battle with the giants' fearsome leader!"
Giantslayer,https://pathfinderwiki.com/wiki/Giantslayer,Anvil of Fire,https://pathfinderwiki.com/wiki/Anvil_of_Fire,"Tracking down the Storm Tyrant?sfire giant allies, the heroes head for the elite military academy where the Storm Tyrant is training officers for his giant army, a subterranean dungeon complex beneath the caldera of a dormant volcano in the Mindspin Mountains. Facing off against the fire giant king Tytarian and his family, the heroes learn about the Storm Tyrant?s plans to invade Belkzen and lead an army of giants and orcs to conquer the nations of Avistan and gain valuable intelligence about the Storm Tyrant?s flying cloud castle and his top generals."
Giantslayer,https://pathfinderwiki.com/wiki/Giantslayer,Shadow of the Storm Tyrant,https://pathfinderwiki.com/wiki/Shadow_of_the_Storm_Tyrant,"The heroes emerge from a fire giant dungeon into a volcano?s caldera, where the Storm Tyrant?s stolen cloud castle floats high above. As the castle takes off into the sky, the heroes must storm the castle and defeat the Storm Tyrant?s guardians and elite giant allies. Finally, they must face the Storm Tyrant himself and his dominated red dragon to put an end to his megalomaniacal push for power. Will the heroes defeat Volstus the Storm Tyrant, or will all of Avistan bend its knee to the mighty warlord and his giant armies?"
Hell's Rebels,https://pathfinderwiki.com/wiki/Hell%27s_Rebels,In Hell's Bright Shadow,https://pathfinderwiki.com/wiki/In_Hell%27s_Bright_Shadow,"The city of Kintargo has long been a safe haven for artists, freethinkers, and those marginalized by the oppressive Chelish government, but now the city has been placed under martial law by inquisitorBarzillai Thrune. When a protest turns into a riot, a new group of heroes comes together to form an organized resistance against the devil-binding government and the church of Asmodeus?but can they survive long enough to establish allies? Or will they become the latest victims of the Thrice-Damned House of Thrune?"
Hell's Rebels,https://pathfinderwiki.com/wiki/Hell%27s_Rebels,Turn of the Torrent,https://pathfinderwiki.com/wiki/Turn_of_the_Torrent,"The rebel group known as the Silver Ravens once fought for independence in the city of Kintargo, but after the nation's civil war came to an end, they disbanded?until today! Now, new heroes have re-established the rebel group to stand against the inquisitorBarzillai Thrune and his oppressive diabolic regime. But before the Silver Ravens can rise up, they'll need allies?friends among powerful groups like the Hellknights of the Torrent, Kintargo's established rebel cults, and disenfranchised agents of the government itself. But until the heroes find the perfect hideout for their rebellion?a place secret enough and strong enough to withstand the battles to come?they'll be forced to stay in the shadows. When a perfect site for their headquarters comes along, will the heroes survive long enough to claim it as their own?"
Hell's Rebels,https://pathfinderwiki.com/wiki/Hell%27s_Rebels,Dance of the Damned,https://pathfinderwiki.com/wiki/Dance_of_the_Damned,"With a hideout in the city of Kintargo established, the heroes of the growing rebellion are poised to take back the city. But before their group, the Silver Ravens, can strike against the diabolicHouse Thrune, a few final preparatory steps must be completed. Forging alliances with nearby tribes of aquatic elves and the free-city of Vyre and closing the mountain pass known as Menador Gap will cut off Cheliax's easy sea and land routes, forcing Inquisitor Barzillai Thrune to rely on his resources at hand to defend his control of Kintargo. Yet nothing is as simple as it could be, and the dangers awaiting the heroes of the revolution in the nearby seas, mountains, and the sin-wracked city of Vyre are not always those you can defeat with a spell or sword. And of course, Barzillai Thrune won't take these new developments lying down?what retributive reaction might one of Cheliax's most dangerous inquisitors have in plan for the Silver Ravens?"
Hell's Rebels,https://pathfinderwiki.com/wiki/Hell%27s_Rebels,A Song of Silver,https://pathfinderwiki.com/wiki/A_Song_of_Silver,"The time has come to take back the Silver City of Kintargo! Too long has the diabolic Lord-Mayor Barzillai Thrune inflicted upon his citizens cruelties and increasingly oppressive laws. The heroes of the beleaguered city finally strike back, and as their rebellion mobilizes in the city streets to stand against the corrupt government's minions, the heroes themselves must strike at the sources. Rescuing old heroes from forgotten prison cells, reclaiming control of historic and key locations, and the performance of an ancient song that was used years ago to protect the city from Hell's agents are but the preamble for the decisive battle, an assault on the enormous Temple of Asmodeus!"
